{
  "question": "在「甲方出 300 万装修 / 乙方出 100 万履约押金 / 65:35 分成」的条款下，是否承接该公寓项目的品牌运营？",
  "deadline": null,
  "options": [
    {
      "name": "按现条款签约",
      "rationale": "立即锁定项目，但乙方单位经济结构性为负"
    },
    {
      "name": "先做条款压力测试、重谈分成结构后再签",
      "rationale": "以数周时间换取条款确定性"
    },
    {
      "name": "直接放弃该项目",
      "rationale": "避免全部投入，但放弃了已识别的市场机会"
    }
  ],
  "chosen_option": "先做条款压力测试、重谈分成结构后再签",
  "rejected_options": [
    {
      "name": "按现条款签约",
      "reason": "乙方月现金流 -44,523 元、押金 22 个月烧穿，签约即锁定一份乙方 8 年累计亏损的合同"
    },
    {
      "name": "直接放弃该项目",
      "reason": "证据不足以支撑「不承接」；两项 P0 合规核查未完成，可能通道根本不存在，也可能完全合法"
    }
  ],
  "tradeoffs": [
    "放弃立即锁定项目机会",
    "承担甲方转向其他运营商的时间成本"
  ],
  "key_assumptions": [
    "乙方会接受 65:35 的分成结构",
    "稳态出租率可达 93%"
  ],
  "falsification_conditions": [
    "若甲方坚持 65:35，乙方必然拒签或签约后违约退出",
    "若同街实测稳态出租率低于 88%，全部回本测算翻转"
  ],
  "validation_actions": [
    "把现条款与反解出的可行区间同时摆给双方，做条款压力测试"
  ],
  "review_date": "2026-06-30",
  "decision_id": "DR-001"
}
